Unnamed: 0,ID,dist,Hebrew,Where_,geometry,google_unigrams_bigrams_unigrams
0,1034,900.1008279001923,כיכר מסריק,ליד רחוב אבן גבירול לב העיר,POINT (668179.2938999999 3551416.8038),0.6114322167542423
1,1069,440.8453494811208,כיכר מסריק,בקרבת כיכר רבין וכיוון דיזינגהוף סנטר,POINT (667527.6413000003 3550129.6382),0.2913678981310486
2,1083,357.8288203003462,כיכר מסריק,בין כיכר רבין לכיכר דיזינגוף,POINT (667452.9326999998 3550453.992000001),0.2913678981310486
3,1150,230.21867103672332,כיכר מסריק,ליד כיכר רבין,POINT (668055.9013999999 3550728.1424),0.2913678981310486
4,1169,240.5794233575835,כיכר מסריק,מרכז העיר ליד כיכר רבין,POINT (668053.8541000001 3550744.0557),0.2913678981310486
5,1232,240.5794233575835,כיכר מסריק,מדובר בכיכר בין כיכר רבין לדיזינגוף סנטר הכיכר מוקפת בנייני מגורים נמצאת ממש על הגבול הדרומי של כיכר רבין,POINT (668053.8541000001 3550744.0557),0.2913678981310486
6,1242,240.5794233575835,כיכר מסריק,שתי דקות הליכה דרום מזרח מכיכר רבין וגם לא רחוק מדיזינגוף סנטר,POINT (668053.8541000001 3550744.0557),0.2913678981310486
7,1271,762.035705807142,כיכר מסריק,יחסית בצפון הישן של העיר בצפון אבן גבירול,POINT (668153.3772999998 3551279.7051),0.9499677578705886
8,1288,240.5794233575835,כיכר מסריק,ברחוב קינג ג׳ורג׳ אם הולכים מדיזינגוף סנטר לכיוון כיכר רבין מגיעים למקום,POINT (668053.8541000001 3550744.0557),0.2806249850174091
9,1309,440.8453494811208,כיכר מסריק,בין כיכר רבין לדיזנגוף סנטר,POINT (667527.6413000003 3550129.6382),0.2913678981310486
10,1310,380.4500323711928,כיכר מסריק,מרכז העיר תת אביב,POINT (667430.9318000004 3550512.5941),0.8133126507858011
11,1316,240.5794233575835,כיכר מסריק,ברחוב מסריק בצמוד יחסית לכיכר רבין מדרום מערב,POINT (668053.8541000001 3550744.0557),0.2913678981310486
12,1393,240.5794233575835,כיכר מסריק,ליד כיכר רבין על קינג ג׳ורג׳,POINT (668053.8541000001 3550744.0557),0.2913678981310486
13,1439,240.5794233575835,כיכר מסריק,בפינה הדרום מערבית של כיכר רבין יוצא רחוב קינג גורג לכיוון דרום כמה מטרים בהמשך הרחוב לכיוון דרום ישנו גן מלבני בתוך כיכר תנועה,POINT (668053.8541000001 3550744.0557),0.2806249850174091
14,1447,762.035705807142,כיכר מסריק,בתל אביב ליד שדרות חן,POINT (668153.3772999998 3551279.7051),0.22912731117099283
15,1449,240.5794233575835,כיכר מסריק,מרכז העיר ליד כיכר רבין,POINT (668053.8541000001 3550744.0557),0.2913678981310486
16,1504,0.0,כיכר מסריק,כיכר מסריק נמצאת בצידה הדרומי של כיכר רבין כאשר רחוב פרישמן מפריד ביניהן בנוסף ניתן לומר שהיא נמצאת בצידו הצפוני של רחוב קינג גורג ושל דיזי,POINT (667868.7083999999 3550519.094599999),0.0
17,1553,900.1008279001923,כיכר מסריק,הכיכר מחברת בין אהן גבירול לתחילתו המזרחע של קינג גורג ההולך מזרח מערב,POINT (668179.2938999999 3551416.8038),0.6355164813146954
18,1581,240.5794233575835,כיכר מסריק,קינג גורג קרוב לכיכר רבין,POINT (668053.8541000001 3550744.0557),0.2425209186557357
19,1627,0.0,כיכר מסריק,קצה רחוב נצח ישראל וקינג גורג סמוך לסנטר,POINT (667833.2538000001 3550462.3848),0.14933931176488907
20,1639,0.0,כיכר מסריק,כיכר מוארכת וירוקה ברחוב מסריק סמוך לצומת מסריקפרידמן וכיכר רבין,POINT (667868.7083999999 3550519.094599999),0.2913678981310486
21,1670,240.5794233575835,כיכר מסריק,במרכז תל אביב קרוב לכיכר רבין,POINT (668053.8541000001 3550744.0557),0.2425209186557357
22,1698,933.253674265542,כיכר מסריק,ליד העיריה וליד אבן גבירול,POINT (668165.7326999996 3551455.8708),0.7242148376334406
23,1739,558.534556246042,כיכר מסריק,צפון רחוב קינג גורג,POINT (667546.5537999999 3549971.3222),0.6355164813146954
24,1796,240.5794233575835,כיכר מסריק,פרישמן כיכר רבין תמשיך קצת מערבה וזה מדרום אלייך,POINT (668053.8541000001 3550744.0557),0.2693437183385045
25,1808,480.0501790151268,כיכר מסריק,המקום נמצא בין הרחובות פרישמן ונצח ישראל בתל אביב הכיכר מחבר בין הרחובות מאנה רייך נצח ישראל ושדרות מסריק,POINT (667362.2536000004 3550652.525900001),0.035961047683955964
26,1876,480.0501790151268,כיכר מסריק,קרובה לכיכר רבין בהמשך פרישמן ולשדרות מסריק,POINT (667362.2536000004 3550652.525900001),0.035961047683955964
27,1909,230.21867103672332,כיכר מסריק,ככר בין ככר רבין ופרישמן לקינג גורג רחוב מאבן גבירול,POINT (668055.9013999999 3550728.1424),0.2913678981310486
28,1940,240.5794233575835,כיכר מסריק,דרומית לכיכר רבין ממשיכים בכביש מהפינה הדרומית מערבית,POINT (668053.8541000001 3550744.0557),0.2913678981310486
29,1941,240.5794233575835,כיכר מסריק,צמודה לכיכר רבין וקטנה ממנה בגודל מגרש כדורגל בלב העיר מלבנית כאשר הצד הצפוני פתוח וללא מבנים,POINT (668053.8541000001 3550744.0557),0.2913678981310486
30,1943,240.5794233575835,כיכר מסריק,בסמוך לכיכר רבין כיכר מלכי ישראל לשעבר בקצה שדרות מסריק היוצאת דרומה מפרישמן קרוב לדיזינגוף סנטר,POINT (668053.8541000001 3550744.0557),0.035961047683955964
31,2030,32.639512776816986,כיכר מסריק,כיכר בצורה מלבנית בהמשך לרחוב קינג גורג,POINT (667814.9709000001 3550424.7664),0.6355164813146954
32,2042,440.8453494811208,כיכר מסריק,בין כיכר רבין לדיזינגוף סנטר,POINT (667527.6413000003 3550129.6382),0.2913678981310486
33,2070,240.5794233575835,כיכר מסריק,מרכז תל אביב מאוד קרוב לכיכר רבין המפורסמת,POINT (668053.8541000001 3550744.0557),0.2425209186557357
34,2091,240.5794233575835,כיכר מסריק,נמצא סמוך לכיכר רבין הולכים על רחוב פרשימן שמהווה את הצלע הדרומית שלו חוצים את הכביש ומגיעים לכיכר קטנה שממנה יוצא רחוב קינג גורג בהמשך,POINT (668053.8541000001 3550744.0557),0.0
35,2134,240.5794233575835,כיכר מסריק,בין כיכר דיזינגוף לכיכר רבין,POINT (668053.8541000001 3550744.0557),0.2913678981310486
36,2151,240.5794233575835,כיכר מסריק,בין כיכר רבין לדיזינגוף סנטר איפשה שחומוס כספי,POINT (668053.8541000001 3550744.0557),0.2913678981310486
37,2208,440.8453494811208,כיכר מסריק,בין כיכר רבין לדיזנגוף סנטר בתחילת רחוב קינג גורג,POINT (667527.6413000003 3550129.6382),0.2913678981310486
38,2238,240.5794233575835,כיכר מסריק,קרוב לכיכר רבין על רח מסריק,POINT (668053.8541000001 3550744.0557),0.2425209186557357
39,1035,0.0,שוק הפשפשים,יפו ליד כיכר השעון,POINT (665809.1206 3547877.331499999),0.21274826026164187
40,1068,316.36921568710204,שוק הפשפשים,דרום תל אביב יפו,POINT (666008.4661999997 3547258.563200001),0.4392641105519527
41,1120,710.2943358136749,שוק הפשפשים,ביפו קרוב לים קרוב למלביה לא ממש רחוב ספציפי יותר אזור,POINT (666648.5773 3547458.510299999),0.3402061133702454
42,1136,4027.198096820849,שוק הפשפשים,נמצא בדרום תל אביב,POINT (668153.3772999998 3551279.7051),4.283836073562924
43,1183,0.0,שוק הפשפשים,יפו ליד כיכר השעון,POINT (665809.1206 3547877.331499999),0.21274826026164187
44,1184,0.0,שוק הפשפשים,ביפו ליד כיכר השעון,POINT (665809.1206 3547877.331499999),0.21274826026164187
45,1190,619.9435077946337,שוק הפשפשים,בדרום תל אביב יפו ליד חוף יפו ומזרחה לכיכר השעון,POINT (665094.6930999998 3547484.0284),0.21274826026164187
46,1255,619.9435077946337,שוק הפשפשים,המקום נמצא ביפו בסמטאות צפופות,POINT (665094.6930999998 3547484.0284),0.2465132760685737
47,1259,316.36921568710204,שוק הפשפשים,במרכז יפו בין הרחובות,POINT (666008.4661999997 3547258.563200001),0.4392641105519527
48,1260,4027.198096820849,שוק הפשפשים,בדרום תל אביב צמוד ליפו,POINT (668153.3772999998 3551279.7051),4.282139622935533
49,1371,619.9435077946337,שוק הפשפשים,צמוד לעיר העתיקה ביפו,POINT (665094.6930999998 3547484.0284),0.2465132760685737
50,1372,4027.198096820849,שוק הפשפשים,דרום תל אביב,POINT (668153.3772999998 3551279.7051),4.283836073562924
51,1408,0.0,שוק הפשפשים,יפו ליד כיכר השעון לא רחוק משדרות ירושלים,POINT (665809.1206 3547877.331499999),0.21274826026164187
52,1440,4027.198096820849,שוק הפשפשים,תל אביב יפו,POINT (668153.3772999998 3551279.7051),0.4392641105519527
53,1442,4027.198096820849,שוק הפשפשים,בתל אביב דרום תל אביב,POINT (668153.3772999998 3551279.7051),4.283836073562924
54,1482,4027.198096820849,שוק הפשפשים,ביפו בדרום תל אביב,POINT (668153.3772999998 3551279.7051),0.2465132760685737
55,1503,3744.522304262651,שוק הפשפשים,שוק על גבול יפו תל אביב השוק חודש ונראה מאוד נקי,POINT (669336.2725 3549629.634099999),0.4392641105519527
56,1538,1026.3237797849026,שוק הפשפשים,צפון יפו ליד שדרות ירושלים,POINT (665913.1753000002 3546541.479699999),0.4392641105519527
57,1568,0.0,שוק הפשפשים,בתוך יפו קרוב ליפו העתיקה סע על עולי ציון אחד הרחובות המרכזיים באזור עד בערך קפה פועה יש שם עוד בתי קפה,POINT (665851.858 3547668.9332),0.0
58,1640,316.36921568710204,שוק הפשפשים,באזור יפו מאחורי המאפייה המפורסמת שכחתי את השם,POINT (666008.4661999997 3547258.563200001),0.4392641105519527
59,1645,1.2079653984616479,שוק הפשפשים,השוק ביפו ניתן להגיע אליו מתל אביב לנסוע דרום עד קיבוץ גלויות ולנסוע מערבה עד מגדל השעון משם הולכים דרומה בסמטאות ומגיעים,POINT (665802.3627000004 3547874.748500001),0.0
60,1699,80.88210340282853,שוק הפשפשים,יפו ליד העיר העתיקה,POINT (665700.4250999996 3547863.4311),0.4392641105519527
61,1730,0.0,שוק הפשפשים,יפו פשוט לחפש שוק הפשפשים ביפו,POINT (665851.858 3547668.9332),0.0
62,1744,0.0,שוק הפשפשים,ביפו באיזור של אבולעפיה בית אפיה,POINT (665769.7719999999 3547803.244999999),0.4392641105519527
63,1789,316.36921568710204,שוק הפשפשים,במרכז יפו העתיקה בין הרחובות,POINT (666008.4661999997 3547258.563200001),0.2465132760685737
64,1809,316.36921568710204,שוק הפשפשים,ביפו אין מה להוסיףףף,POINT (666008.4661999997 3547258.563200001),0.3203155859194308
65,1835,6841.028023382733,שוק הפשפשים,בתל אביב ליד ספסלים וקרוב לחניות רבות,POINT (670508.7692999998 3553031.639799999),3.778314931201758
66,1921,0.0,שוק הפשפשים,שוק הפשפשים נמצא ביפו כמספר דקות הליכה מכיכר השעון לכיוון דרום מזרח,POINT (665851.858 3547668.9332),0.0
67,1931,4027.198096820849,שוק הפשפשים,הוא נמצא אזור יפו,POINT (668153.3772999998 3551279.7051),0.4392641105519527
68,1959,619.9435077946337,שוק הפשפשים,בלב יפו מזרחית ליפו העתידה,POINT (665094.6930999998 3547484.0284),0.2465132760685737
69,1992,0.0,שוק הפשפשים,שוק ביפו השוק המרכזי,POINT (665851.858 3547668.9332),0.0
70,1993,0.0,שוק הפשפשים,שוק הפשפשים נמצא באיזור יפו,POINT (665851.858 3547668.9332),0.0
71,2066,619.9435077946337,שוק הפשפשים,דרום תל אביב ליד נמל יפו הישן,POINT (665094.6930999998 3547484.0284),0.2465132760685737
72,2105,316.36921568710204,שוק הפשפשים,המקום נמצא ביפו על יד השעון,POINT (666008.4661999997 3547258.563200001),0.2465132760685737
73,2136,1.2079653984616479,שוק הפשפשים,ביפו לא רחוק מכיכר השעון קצת דרום מזרחה,POINT (665802.3627000004 3547874.748500001),0.21169594861193947
74,2193,619.9435077946337,שוק הפשפשים,בחיבור יפו תל אביב לא רחוק מים,POINT (665094.6930999998 3547484.0284),0.4392641105519527
75,2216,0.0,שוק הפשפשים,ביפו קרוב לנמל ממש ליד כיכר השעון,POINT (665809.1206 3547877.331499999),0.21274826026164187
76,2246,0.0,שוק הפשפשים,יפו ליד כיכר השעון,POINT (665809.1206 3547877.331499999),0.21274826026164187
77,1036,114.3250773741901,כיכר דיזינגוף,על רחוב דיזינגוף יחסית קרוב לדיזינגוף סנטר ליד תאטרון בית לסין קפה לנדוור,POINT (667400.4812000003 3550621.6819),0.17571111809208736
78,1037,280.6569540465849,כיכר דיזינגוף,בערך באמצע רחוב דיזינגוף,POINT (667527.6413000003 3550129.6382),0.30594820652622645
79,1115,280.6569540465849,כיכר דיזינגוף,בלב רחוב דיזינגוף צפונית לדיזינגוף סנטר,POINT (667527.6413000003 3550129.6382),0.33286445407244614
80,1148,810.5686801399884,כיכר דיזינגוף,על רחוב דיזינגוף בתל אביב,POINT (667482.2296000002 3551325.649599999),0.8721970054181716
81,1197,280.6569540465849,כיכר דיזינגוף,על רחוב דיזנגוף בחלק היחסית דרומי,POINT (667527.6413000003 3550129.6382),0.31028094372534215
82,1200,280.6569540465849,כיכר דיזינגוף,בתחילת דיזינגוף אחרי דיזינגוף סנטר,POINT (667527.6413000003 3550129.6382),0.0
83,1202,1024.6994946736947,כיכר דיזינגוף,בחלק הצפוני של רחוב דיזינגוף מספר ק״מ דרומית לנמל תל אביב,POINT (668153.3772999998 3551279.7051),0.8721970054181716
84,1203,810.5686801399884,כיכר דיזינגוף,פינת דיזינגוף פינסקר וריינס,POINT (667482.2296000002 3551325.649599999),0.14287354062687777
85,1250,810.5686801399884,כיכר דיזינגוף,באמצע רחוב דיזינגוף בתל אביב,POINT (667482.2296000002 3551325.649599999),0.30594820652622645
86,1322,280.6569540465849,כיכר דיזינגוף,מרכז תל אביב בהמשך על רחוב דיזנגוף מכיוון הסנטר,POINT (667527.6413000003 3550129.6382),0.33286445407244614
87,1333,280.6569540465849,כיכר דיזינגוף,מזרחית לבימה בהמשך לרחוב דיזינגוף בסמוך למרכז מסחרי דיזינגוף סנטר,POINT (667527.6413000003 3550129.6382),0.33286445407244614
88,1337,280.6569540465849,כיכר דיזינגוף,נמצא ברחוב דיזינגוף 1 הכיכר נמצאת מרחק הליכה מדיזינגוף סנטר מהכיוון של החנות של נייק יש גשר,POINT (667527.6413000003 3550129.6382),0.0
89,1420,810.5686801399884,כיכר דיזינגוף,המקום נמצא ברחוב דיזינגוף,POINT (667482.2296000002 3551325.649599999),0.8721970054181716
90,1452,810.5686801399884,כיכר דיזינגוף,ברח דיזינגוף חיבור של מספר רחובות,POINT (667482.2296000002 3551325.649599999),0.33286445407244614
91,1454,280.6569540465849,כיכר דיזינגוף,מרכז העיר צפונית לדיזינגוף סנטר,POINT (667527.6413000003 3550129.6382),0.33286445407244614
92,1476,280.6569540465849,כיכר דיזינגוף,כיכר דיזינגוף נמצאת ברחוב דיזינגוף סמוך לדיזינגוף סנטר,POINT (667527.6413000003 3550129.6382),0.0
93,1534,0.0,כיכר דיזינגוף,במפגש של דיזינגוף ריינס וזמנהוף בסמוך לדיזנגוף סנטר,POINT (667452.9326999998 3550453.992000001),0.1303534161404823
94,1536,280.6569540465849,כיכר דיזינגוף,נוסעים על רחוב דיזינגוף מכיוון צפון לכיוון דרום עד שמגיעים לכיכר גדולה,POINT (667527.6413000003 3550129.6382),0.33286445407244614
95,1588,108.0380963826695,כיכר דיזינגוף,רחוב דיזינגוף מרכז תא,POINT (667484.8355 3550296.865499999),0.33286445407244614
96,1617,810.5686801399884,כיכר דיזינגוף,בקצה של דיזינגוף,POINT (667482.2296000002 3551325.649599999),0.33286445407244614
97,1664,280.6569540465849,כיכר דיזינגוף,חיבור של דיזינגוף עם רחוב נוסף שאני לא זוכר,POINT (667527.6413000003 3550129.6382),0.33286445407244614
98,1685,810.5686801399884,כיכר דיזינגוף,בחלקו הדרומי של רחוב דיזנגוף,POINT (667482.2296000002 3551325.649599999),0.8721970054181716
99,1690,810.5686801399884,כיכר דיזינגוף,צומת של דיזנגוף ריינס ועוד רחוב אחד,POINT (667482.2296000002 3551325.649599999),0.1303534161404823
100,1722,1024.6994946736947,כיכר דיזינגוף,לכיוון אזור צפון תל אביב,POINT (668153.3772999998 3551279.7051),1.044176697714993
101,1723,0.0,כיכר דיזינגוף,ככר בצומת הרחובות דיזנגוף פינסקר,POINT (667452.9326999998 3550453.992000001),0.14287354062687777
102,1788,317.5778746835652,כיכר דיזינגוף,בלב תל אביב על רחוב דיזינגוף,POINT (667588.7982000001 3550109.075300001),0.37073146884349534
103,1857,0.0,כיכר דיזינגוף,כיכר מרכזית בתל אביב על רחוב דיזנגוף,POINT (667452.9326999998 3550453.992000001),0.0
104,1898,3448.7974294994,כיכר דיזינגוף,מרכז צפון תל אביב,POINT (666008.4661999997 3547258.563200001),1.769971934421941
105,1922,280.6569540465849,כיכר דיזינגוף,מרכז תל אביב ליד הסנטר,POINT (667527.6413000003 3550129.6382),0.33286445407244614
106,1956,810.5686801399884,כיכר דיזינגוף,מרכז העיר על רחוב דיזינגוף,POINT (667482.2296000002 3551325.649599999),0.8721970054181716
107,2014,1024.6994946736947,כיכר דיזינגוף,הכיכר נמצאת קרוב למרכז תל אביב לא רחוק מהים,POINT (668153.3772999998 3551279.7051),2.3441520619261365
108,2020,280.6569540465849,כיכר דיזינגוף,בהמשך לדיזינגוף סנטר ליד רחוב בוגרשוב,POINT (667527.6413000003 3550129.6382),0.33286445407244614
109,2047,810.5686801399884,כיכר דיזינגוף,רחוב דיזנגוף תל אביב,POINT (667482.2296000002 3551325.649599999),0.8721970054181716
110,2087,1805.4035517651168,כיכר דיזינגוף,ברחוב דיזינגוף ליד תחנת השלום,POINT (669252.0716000004 3549978.295399999),0.33286445407244614
111,2098,280.6569540465849,כיכר דיזינגוף,ברחוב דיזינגוף ליד דיזינגוף סנטר,POINT (667527.6413000003 3550129.6382),0.33286445407244614
112,2140,280.6569540465849,כיכר דיזינגוף,מרכז תל אביב לא רחוק מהים ומדיזינגוף סנטר,POINT (667527.6413000003 3550129.6382),0.33286445407244614
113,2178,0.0,כיכר דיזינגוף,כיכר בתחילת רחוב דיזינגוף,POINT (667452.9326999998 3550453.992000001),0.8721970054181716
114,2197,1024.6994946736947,כיכר דיזינגוף,במרכז תל אביב קצת מערבה,POINT (668153.3772999998 3551279.7051),1.9057424318147058
115,2239,317.5778746835652,כיכר דיזינגוף,לב העיר קרוב לדיזינגוף סנטר על רחוב דיזנגוף,POINT (667588.7982000001 3550109.075300001),0.33286445407244614
116,1038,2221.6016749655723,התחנה המרכזית החדשה,דרום תל אביב ליד רכבת תל אביב ההגנה,POINT (669252.0716000004 3549978.295399999),0.5705871612683067
117,1065,3171.3087750202885,התחנה המרכזית החדשה,בגבול בין לב תל אביב לצפון תל אביב ליד רחוב נווה שאנן,POINT (668153.3772999998 3551279.7051),0.34310877825431924
118,1134,410.3668301336617,התחנה המרכזית החדשה,אפשר להגיע מאיזור רכבת ההגנה או בעזרת אוטובוסים רבים שזו התחנה הסופית שלהם,POINT (668495.9445000002 3547821.160800001),0.38327164153251025
119,1152,410.3668301336617,התחנה המרכזית החדשה,ליד רכבת תל אביב ההגנה,POINT (668495.9445000002 3547821.160800001),0.5705871612683067
120,1156,410.3668301336617,התחנה המרכזית החדשה,ליד רכבת תל אביב ההגנה,POINT (668495.9445000002 3547821.160800001),0.5705871612683067
121,1227,410.3668301336617,התחנה המרכזית החדשה,דרום העיר ליד רכבת ההגנה,POINT (668495.9445000002 3547821.160800001),0.5737384701004966
122,1297,410.3668301336617,התחנה המרכזית החדשה,לא רחוק מרכבת ההגנה,POINT (668495.9445000002 3547821.160800001),0.5705871612683067
123,1306,410.3668301336617,התחנה המרכזית החדשה,נמצאת ליד תחנת רכבת ההגנה,POINT (668495.9445000002 3547821.160800001),0.5705871612683067
124,1365,113.89633271417135,התחנה המרכזית החדשה,דרום תל אביב על רחוב לווינסקי,POINT (667862.3170999996 3548228.195900001),0.45815596367891664
125,1369,2221.6016749655723,התחנה המרכזית החדשה,דרום תל אביב כמה דקות הליכה מתחנת הרכבת תלאביב ההגנה,POINT (669252.0716000004 3549978.295399999),0.5705871612683067
126,1432,3396.938602877743,התחנה המרכזית החדשה,לא רחוק מתחנת רכבת מרכז,POINT (669585.9572999999 3551127.4706),3.4821373269141236
127,1434,3171.3087750202885,התחנה המרכזית החדשה,נמצא בדרום תל אביב באיזור שד בן ציון,POINT (668153.3772999998 3551279.7051),0.30256527670693234
128,1437,410.3668301336617,התחנה המרכזית החדשה,דרום תל אביב קרוב לתחנת רכבת ההגנה,POINT (668495.9445000002 3547821.160800001),0.5705871612683067
129,1505,352.41441271479897,התחנה המרכזית החדשה,נמצא על רחוב לוינסקי כחצי קילומטר מערבה מרכבת ההגנה אם הולכים מערבה אז המקום יהיה משמאלך,POINT (667602.9397999998 3548316.779200001),0.30256527670693234
130,1539,2221.6016749655723,התחנה המרכזית החדשה,דרום תל אביב ממערב לתחנת רכבת ההגנה,POINT (669252.0716000004 3549978.295399999),0.5705871612683067
131,1565,2221.6016749655723,התחנה המרכזית החדשה,בכניסה הדרומית לעיר תל אביב ליד תחנת רכבת השלום,POINT (669252.0716000004 3549978.295399999),2.3213598254510477
132,1569,6944.348032937624,התחנה המרכזית החדשה,ממש מעל איילון וקרוב לרכבת טיפה לפני שמגיעים ליפו,POINT (672694.7430999996 3553300.9723),1.9885558286360296
133,1621,352.41441271479897,התחנה המרכזית החדשה,בקצה של שוק לוינסקי ואלנבי אם ממשיכים עוד קצת מזרחה על רחוב לוינסקי מימין יש בניין עצום עם גשר רכבים שנכנס אליו,POINT (667602.9397999998 3548316.779200001),0.45815596367891664
134,1651,3514.317733612821,התחנה המרכזית החדשה,נמצאת בדרום תל אביב מגיעים אליו דרך כביש איילון מצפון ומדרום למחלף להגווארדיה פונים לרחוב לווינסקי וממשיכים על הכביש עד שמגיעים,POINT (669676.7814999996 3551214.3543),0.45815596367891664
135,1731,453.9020917181839,התחנה המרכזית החדשה,ליד התחנה המרכזית הישנה צריך לחפש חנייה באחד החניונים בסביבה כי קשה למצוא קרוב,POINT (667968.3158 3548566.8486),0.0
136,1753,3171.3087750202885,התחנה המרכזית החדשה,כמעט כל אוטובוס מגיע אליו בניין גדול בעל כמה קומות באצמע דרום תל אביב מקום מפחיד של התכנסות אסור לרדת רק לעלות,POINT (668153.3772999998 3551279.7051),0.8641184556063202
137,1757,0.0,התחנה המרכזית החדשה,מבנה בטון ענק אפשר להיכנס אליו מכמה רחובות בדרום תל אביב ליד הגג יש מסוף אוטובוסים,POINT (667970.2947000004 3548043.0364),2.9323181435463153
138,1768,3171.3087750202885,התחנה המרכזית החדשה,דרום תל אביב,POINT (668153.3772999998 3551279.7051),3.242245770887624
