Unnamed: 0,ID,dist,Hebrew,Where_,geometry,google_unigrams_bigrams_unigrams
697,1823,120.63627723466386,חוף גורדון,מרינה תל אביב נמל רצועת החוף,POINT (666984.4408999998 3551300.2468),0.3772706261748025
698,1867,1137.8407751768261,חוף גורדון,המקום הכי מערבי בתל אביב חוף הים בין תחנת רידינג ליפו,POINT (666438.5607000003 3549553.2117),2.1311516432819206
699,1868,1137.8407751768261,חוף גורדון,בשרשרת חופים של תל אביב,POINT (666438.5607000003 3549553.2117),1.3877254320666033
700,1918,310.65051912681787,חוף גורדון,חוף גורדון נמצא במערב תל אביב בסמוך לרחוב גורדון,POINT (667192.4222999997 3550956.021400001),0.669187994963458
701,1948,171.43640172963956,חוף גורדון,חוף ליד כיכר אתרים והמלון הצבעוני,POINT (667038.3819000004 3551328.246400001),0.4290062293039647
702,1972,6826.8722981764095,חוף גורדון,חוף יום בחלקה הצפוני יחסית של תל אביב,POINT (668927.6993000004 3557719.2697),3.0254817156840454
703,2031,1137.8407751768261,חוף גורדון,חוף ים בטיילת במרכז תל אביב,POINT (666438.5607000003 3549553.2117),0.4216803303073877
704,2072,120.63627723466386,חוף גורדון,ברצועת הים של תל אביב בחלקה הצפוני באזור מרינת תל אביב,POINT (666984.4408999998 3551300.2468),0.3772706261748025
705,2125,1137.8407751768261,חוף גורדון,חוף ים בתל אביב,POINT (666438.5607000003 3549553.2117),1.3877254320666033
706,2135,363.1567058757008,חוף גורדון,בתל אביב לא רחוק מבניין האופרה ליד הקונסוליה האמריקאית,POINT (666746.7938999999 3550306.762499999),1.80123773220119
707,2179,1137.8407751768261,חוף גורדון,חוף ים בתל אביב,POINT (666438.5607000003 3549553.2117),1.3877254320666033
708,2240,3532.7979735238814,חוף גורדון,טיילת תל אביב מולבית האופרה,POINT (665094.6930999998 3547484.0284),2.0760084985282785
709,1058,2906.803430225379,נמל תל אביב,על חוף הים יחסית בצפון תל אביב,POINT (666438.5607000003 3549553.2117),1.8999065119091727
710,1082,1374.6992031023672,נמל תל אביב,צפון מערב תל אביב צמוד לים צמוד לרידינג,POINT (668153.3772999998 3551279.7051),1.520517700077605
711,1086,1374.6992031023672,נמל תל אביב,החוף הצפוני במרכז תל אביב כאשר מפסיק החול ומתחיל הדק,POINT (668153.3772999998 3551279.7051),2.742370174577856
712,1155,1374.6992031023672,נמל תל אביב,בתל אביב בטיילת המרכזית,POINT (668153.3772999998 3551279.7051),2.1368596310260415
713,1170,1374.6992031023672,נמל תל אביב,נמצא בצפון תל אביב על הים דרומית לרידינג,POINT (668153.3772999998 3551279.7051),0.5568412818685484
714,1207,2906.803430225379,נמל תל אביב,צפון תל אביב ליד הים,POINT (666438.5607000003 3549553.2117),1.8999065119091727
715,1216,1224.9329918422754,נמל תל אביב,המקום נמצא על הים באזור הצפון הישן מעט דרומית לנחל הירקון,POINT (668910.3684999999 3552602.4059),0.38904218775328697
716,1263,2906.803430225379,נמל תל אביב,ליד חוף הים בצפון תל אביב,POINT (666438.5607000003 3549553.2117),1.8999065119091727
717,1264,1869.1675376905355,נמל תל אביב,ליד הים בסוף רחוב הירקון,POINT (666854.7161999997 3550521.1533),1.5258410342102362
718,1270,1532.7440930011026,נמל תל אביב,בצפון תל אביב יושב ליד הים,POINT (666910.0789999999 3550853.099199999),1.8999065119091727
719,1356,2822.135242985215,נמל תל אביב,הנמל נמצא ליד חניון רידינג בסוף פארק הירקון נמצא באזור צפון תל אביב,POINT (670508.7692999998 3553031.639799999),0.5483986214648351
720,1389,364.2800415455577,נמל תל אביב,צפון העיר ליד הים ליד תחנת הכוח רידינג,POINT (667812.1387999998 3553414.808499999),1.5220130615993641
721,1390,131.44093870876674,נמל תל אביב,בחיבור של הים כם הירשון מתחיל הנמל עד חוף מציצים,POINT (667181.6836000001 3552227.857899999),0.008594129187382532
722,1391,1374.6992031023672,נמל תל אביב,נמצא בצפון תל אביב צמוד לים,POINT (668153.3772999998 3551279.7051),1.520517700077605
723,1493,1532.7440930011026,נמל תל אביב,בצפון תל אביב ליד הים דרומית להיכן שהירקון מתחבר לים,POINT (666910.0789999999 3550853.099199999),0.5276311850957605
724,1526,2822.135242985215,נמל תל אביב,בחלק המערבי של תל אביב צמוד לשפל של נחל הירקון איפה שפארק הירקון פוגש את חוף הים,POINT (670508.7692999998 3553031.639799999),1.520517700077605
725,1557,1224.9329918422754,נמל תל אביב,נמצא בחלקו המערבי ביותר של תל אביב משפך הירקון ורדינג ודרומה,POINT (668910.3684999999 3552602.4059),0.5708248331429623
726,1597,364.2800415455577,נמל תל אביב,נמל תל אביב שוכן בצמוד לארובה של תחנת חשמל רידינג מצפון ועד לחוף מציצים מדרום,POINT (667812.1387999998 3553414.808499999),0.0
727,1657,1374.6992031023672,נמל תל אביב,בקצה הכי צפון מערבי של תל אביב,POINT (668153.3772999998 3551279.7051),2.973982038529342
728,1658,364.2800415455577,נמל תל אביב,בצפון תל אביב בקצה פארק הירקון ליד תחנת כח רידינג,POINT (667812.1387999998 3553414.808499999),1.5258410342102362
729,1709,2906.803430225379,נמל תל אביב,ממש ליד הים בצפון תל אביב,POINT (666438.5607000003 3549553.2117),1.8999065119091727
730,1735,2906.803430225379,נמל תל אביב,צפון תא על קו החוף,POINT (666438.5607000003 3549553.2117),1.8999065119091727
731,1748,1374.6992031023672,נמל תל אביב,נמל תא נמצא בדרום העיר,POINT (668153.3772999998 3551279.7051),0.008594129187382532
732,1810,0.0,נמל תל אביב,נמל תל אביב נמצא בצפון תל אביב על הגבול בין תל אביב להרצליה,POINT (667384.6447999999 3552591.4901),0.0
733,1833,2906.803430225379,נמל תל אביב,רצועת החוף של תל אביב יפו,POINT (666438.5607000003 3549553.2117),5.507944576335879
734,1901,1374.6992031023672,נמל תל אביב,צפון מערב העיר תל אביב,POINT (668153.3772999998 3551279.7051),2.7041410173618456
735,1938,176.04957840542897,נמל תל אביב,ממש על חוף מציצים בתל אביב,POINT (667120.2724000001 3552202.6511),2.920738702055647
736,1969,2822.135242985215,נמל תל אביב,צפון העיר סמוך לירקון ועל קו המים,POINT (670508.7692999998 3553031.639799999),1.5258410342102362
737,2005,364.2800415455577,נמל תל אביב,בצפון תל אביב לצד הים בסמוך לתחנת הכוח רידינג,POINT (667812.1387999998 3553414.808499999),1.8999065119091727
738,2034,1374.6992031023672,נמל תל אביב,צפון תל אביב,POINT (668153.3772999998 3551279.7051),1.8999065119091727
739,2071,1374.6992031023672,נמל תל אביב,צפון תל אביב אחרי גשר רידינג,POINT (668153.3772999998 3551279.7051),0.6089497166868609
740,2110,2906.803430225379,נמל תל אביב,לאורך קו החוף במרכז תל אביב,POINT (666438.5607000003 3549553.2117),2.742370174577856
741,2119,1374.6992031023672,נמל תל אביב,בצפון תל אביב עד הים,POINT (668153.3772999998 3551279.7051),1.8999065119091727
742,2159,2906.803430225379,נמל תל אביב,לאורך הים בין נחל הירקון לבין חוף מציצים,POINT (666438.5607000003 3549553.2117),0.5276311850957605
743,2184,0.0,נמל תל אביב,בנמל תל אביב החדש המשופץ,POINT (667376.2593999999 3552593.3705),0.0
744,2215,364.2800415455577,נמל תל אביב,בצפון תל אביב קרוב לתחנת הכח רידינג,POINT (667812.1387999998 3553414.808499999),1.8999065119091727
745,2242,1547.296281725421,נמל תל אביב,צפון תל אביב ממש בקצה הצפוני של רחוב הירקון,POINT (666898.8898 3550840.484099999),1.5258410342102362
746,1061,765.7455724457631,פארק הירקון,צפון תל אביב קצת אחרי רמת אביב,POINT (669451.1575999996 3553760.5351),1.2845134623878647
747,1125,3492.256672559029,פארק הירקון,צפון העיר חוצה את העיר ממערב למזרח ועד בני ברק,POINT (673199.9263000004 3551323.545299999),7.731040395188509
748,1146,0.0,פארק הירקון,ליד נחל הירקון,POINT (668910.3684999999 3552602.4059),1.6551049158884357
749,1178,387.2357626454738,פארק הירקון,נמצא בצפון תל אביב כאשר יורדים ברוקח נמצא משמאל,POINT (670508.7692999998 3553031.639799999),0.0
750,1199,387.2357626454738,פארק הירקון,פארק לאורך נחל הירקון ושדרות רוקח בצפון תל אביב,POINT (670508.7692999998 3553031.639799999),0.0
751,1217,3492.256672559029,פארק הירקון,צפון העיר צמוד לנמל ועד בני ברק במזרח,POINT (673199.9263000004 3551323.545299999),3.163172277021343
752,1266,1106.7080951140106,פארק הירקון,המקום נמצא בצפון תל אביב ליד חוצה את דרך נמיר משני כיווניו,POINT (669085.8958999999 3554013.9574),1.354569316663425
753,1338,0.0,פארק הירקון,צפון תל אביב לאורך שדרות רוקח,POINT (667979.7143000001 3552570.182),0.8978246575018731
754,1341,968.500767211832,פארק הירקון,בחלק הצפוני של תל אביב מול הלונה פארק,POINT (670956.2248999998 3553677.158600001),0.7854687148003526
755,1361,0.0,פארק הירקון,צפון תל אביב ליד נהר הירקון,POINT (668910.3684999999 3552602.4059),1.6551049158884357
756,1422,0.0,פארק הירקון,על נהר הירקון לאורך כל תל אביב בערך,POINT (668910.3684999999 3552602.4059),0.0
757,1475,0.0,פארק הירקון,על נחל הירקון בצפון תל אביב,POINT (667877.5955999997 3552403.435900001),1.6551049158884357
758,1491,1064.4439805157438,פארק הירקון,הפארק מאוד ארוך משתרע מהים ועד רמת גן ובין השאר חוצה צירים ראשיים כגון דרך נמיר כקילומטר צפונה מרכבת ארלוזורוב,POINT (669084.3288000003 3553969.7049),1.3407864046903886
759,1492,0.0,פארק הירקון,לאורך נחל הירקון הצד המערבי גובל בנמל החיבור של הנחל לים הצד המזרחי גובל בערך בדרך נמיר,POINT (668910.3684999999 3552602.4059),0.5023581520577388
760,1517,3168.4863870204763,פארק הירקון,בצפון תל אביב בין לב תל אביב לרמת אביב,POINT (667790.7470000004 3549202.889),1.2845134623878647
761,1593,1064.4439805157438,פארק הירקון,משני צידי הירקון באזור אבן גבירול נמיר,POINT (669084.3288000003 3553969.7049),0.0
762,1605,387.2357626454738,פארק הירקון,לב תל אביב פאק מדהים שמצא ליד נחל הירקון,POINT (670508.7692999998 3553031.639799999),1.6551049158884357
763,1634,387.2357626454738,פארק הירקון,בסמוך לנחל הירקון בגבול תל אביב בני ברק רמת גן,POINT (670508.7692999998 3553031.639799999),1.6551049158884357
764,1680,0.0,פארק הירקון,בצפון תל אביב לאורך נחל הירקון,POINT (668910.3684999999 3552602.4059),1.6551049158884357
765,1708,4028.82906757105,פארק הירקון,המקום נמצא בין רמת גן לצפון תל אביב והוא מעין גבול בין צפון תל אביב למרכז תל אביב כלומר הוא אופקית ארוך,POINT (672245.3729999997 3549476.602600001),2.0741457098839713
766,1740,968.500767211832,פארק הירקון,מול גני התערוכה ולונה פארק תל אביב,POINT (670956.2248999998 3553677.158600001),0.6915600814506612
767,1787,1100.1653328102784,פארק הירקון,במרכז תל אביב לאורך נחל הירקון עד רמת אביב,POINT (668153.3772999998 3551279.7051),0.0
768,1826,981.9015623161116,פארק הירקון,פארק ענק בתל אביב,POINT (671009.9753999999 3553611.322899999),5.386232555618321
769,1840,635.9666975906533,פארק הירקון,צפון תל אביב בין בבלי לרמת אביב,POINT (668897.9950999999 3553489.5328),1.052990184368061
770,1880,968.500767211832,פארק הירקון,צפון תל אביב מול מתקני הלונה פארק,POINT (670956.2248999998 3553677.158600001),0.7854687148003526
771,1914,15.769801982134394,פארק הירקון,סמוך לשדרות רוקח נפרס מרמת גן במזרח ועד חוף הים במערב,POINT (669610.9971000003 3553026.7085),0.7854687148003526
772,1945,387.2357626454738,פארק הירקון,סביב נחל הירקון בלב העיר באזור רידינג מבחינת צפוןדרום ומחלף רוקח חוצה ממזרח למערב מרמת גן ועד הים,POINT (670508.7692999998 3553031.639799999),0.0
773,1981,0.0,פארק הירקון,צפון העיר על גדול נחל הירקון,POINT (668910.3684999999 3552602.4059),1.4423539231915279
774,2008,387.2357626454738,פארק הירקון,בתל אביב ליד הלונה פארק חיד הנמל באזור הכניסה לתל אביב,POINT (670508.7692999998 3553031.639799999),0.7854687148003526
775,2033,1100.1653328102784,פארק הירקון,המקום נמצא בין מרכז לצפון תל אביב,POINT (668153.3772999998 3551279.7051),2.242881723881183
776,2069,0.0,פארק הירקון,לאורך נחל הירקון בתל אביב הצפון הישן לאורך רחוב בני דן אפשר להגיע דרך סוף רחוב אבן גבירול,POINT (668910.3684999999 3552602.4059),1.6551049158884357
777,2109,6271.471675786709,פארק הירקון,בצפון במרכז העיר תל אביב והעיר רמת גן,POINT (672077.8234000001 3546907.7379),3.9774601754332983
778,2111,1100.1653328102784,פארק הירקון,בין אזור אבן גבירול לצפון תא ומגיע עד נמל תל אביב,POINT (668153.3772999998 3551279.7051),2.242881723881183
779,2158,387.2357626454738,פארק הירקון,לאורך שדרות רוקח פארק גדול ואפשר להגיע בהרבה דרכים שונות למשל בקצה הצפוני של אבן גבירול,POINT (670508.7692999998 3553031.639799999),0.0
780,2182,816.7763437965014,פארק הירקון,ברחוב רוקח מול גני התערוכה,POINT (670866.8962000003 3553528.5595),0.0
781,2214,1100.1653328102784,פארק הירקון,בצפון תל אביב לצד שכונות מגורים מצד אחד מהצד השני כביש ארוך לצידו ממוקם הלונה פארק,POINT (668153.3772999998 3551279.7051),0.7854687148003526
782,2241,4318.271152246902,פארק הירקון,ליד מחלף רוחק בכביש איילון,POINT (671433.9374000002 3557274.942399999),0.3552449610336264
783,1062,1593.1130095052247,כיכר המדינה,הכיכר נמצא בלב תל אביב,POINT (667452.9326999998 3550453.992000001),1.7522675577601028
784,1099,966.648145452086,כיכר המדינה,בצפון מרכז העיר בחיתוך זבוטינסקי לויצמן,POINT (669947.7537000002 3551002.8892),0.09482462317699009
785,1103,271.43594090487505,כיכר המדינה,ויצמן קרוב לבית החייל תל אביב,POINT (668984.4085999997 3551884.5702),0.5281176320947888
786,1106,0.0,כיכר המדינה,בצפון תל אביב רחוב ז׳בוטינסקי איפה ש״בוטיק סנטרל״,POINT (668761.4435000001 3551464.5132),0.09770935215018267
787,1237,0.0,כיכר המדינה,נמצא בין מרכז תל אביב לצפון הישן כאשר רחוב ה באייר הוא הרחוב של הכיכר,POINT (668800.3459000001 3551374.8873),0.0
788,1292,426.91874284849433,כיכר המדינה,בצפון תל אביב קרוב לרחוב וייצמן,POINT (668901.6327999998 3550856.5995),0.13803130359528665
789,1345,675.3662241659105,כיכר המדינה,צפון תל אביב לא רחוק מבית חולים איכילוב,POINT (668937.6744999997 3550609.5732),0.13803130359528665
790,1348,675.3662241659105,כיכר המדינה,ליד ארלוזרוב איזור איכילוב,POINT (668937.6744999997 3550609.5732),0.3602005707806805
791,1349,2079.530178616379,כיכר המדינה,מערבית לאיילון צפונית לקריה ודרומית לפארן הירקון,POINT (670508.7692999998 3553031.639799999),1.2324990592555067
792,1351,559.1059424725114,כיכר המדינה,מערבית לנמיר ומזרחית לאבן גבירול,POINT (668179.2938999999 3551416.8038),0.6224959420189314
793,1489,0.0,כיכר המדינה,אל כיכר המדינה ניתן להגיע מרחובות רבים הנמצאים סביבה כאשר המרכזיים שביניהם הם רחוב ויצמן צפוןדרום ורחוב זבוטינסקי מזרחמערב,POINT (668800.3459000001 3551374.8873),0.0
794,1531,559.1059424725114,כיכר המדינה,צפון העיר מזרחית לאבן גבירול,POINT (668179.2938999999 3551416.8038),0.6224959420189314
795,1558,603.2597291239158,כיכר המדינה,ממוקם בין דרך נמיר לאבן גבירול בחלקו הצפוני של תל אביב הישנה,POINT (668153.3772999998 3551279.7051),0.6224959420189314
796,1598,0.0,כיכר המדינה,כיכר המדינה נמצאת בערך 800 מטר צפונית לבית החולים איכילוב המרכז הרפואי תל אביב ע״ש סוראסקי 400 מטר דרומית לרחוב פנקס ו400 מטר מערבית לדרך נמיר,POINT (668800.3459000001 3551374.8873),0.0
797,1622,552.7679413362772,כיכר המדינה,קרוב לרחוב זבוטינסקי מזרחית לאבן גבירול,POINT (668199.1947999997 3551608.220799999),0.6224959420189314
798,1659,603.2597291239158,כיכר המדינה,במרכז תל אביב מחבר בין רחובות אבן גבירול פנקס ויצמן,POINT (668153.3772999998 3551279.7051),0.5539636795742643
799,1676,603.2597291239158,כיכר המדינה,צפונית לכיכר רבין במרכז העיר בקצה של רחוב ארלוזורוב,POINT (668153.3772999998 3551279.7051),0.5722103709055432
800,1727,3160.6593159939553,כיכר המדינה,במרכז תל אביב אזור גדול מרווח,POINT (670504.2459000004 3554373.6939),0.9344253269648151
801,1771,603.2597291239158,כיכר המדינה,צפון תל אביב מדרום לירקון,POINT (668153.3772999998 3551279.7051),0.13803130359528665
802,1819,2747.090587277529,כיכר המדינה,מרכז תל אביב הכיכר הגדולה ביותר בישראל,POINT (668256.6366999997 3548610.898),0.9344253269648151
803,1878,603.2597291239158,כיכר המדינה,הכיכר נמצאת בצפון מזרח תל אביב על רחוב ז’בוטינסקי,POINT (668153.3772999998 3551279.7051),1.2903094704153923
804,1908,426.91874284849433,כיכר המדינה,מרכז תל אביב רחוב ויצמן,POINT (668901.6327999998 3550856.5995),0.09482462317699009
805,2004,603.2597291239158,כיכר המדינה,הכיכר נמצאת בצפון תל אביב בסמוך לרחוב ז׳בוטינסקי,POINT (668153.3772999998 3551279.7051),0.13803130359528665
806,2035,603.2597291239158,כיכר המדינה,במרכז תל אביב סוף רחוב זבוטינסקי ליד אבן גבירול,POINT (668153.3772999998 3551279.7051),0.6242799110912396
807,2076,2079.530178616379,כיכר המדינה,מרכז תל אביב דרומית לפארק הירקון,POINT (670508.7692999998 3553031.639799999),0.9344253269648151
808,2093,603.2597291239158,כיכר המדינה,צפון מרכז תל אביב קרוב לרחוב ארלוזורוב,POINT (668153.3772999998 3551279.7051),0.2928977263697955
809,2189,603.2597291239158,כיכר המדינה,במרכז תל אביב קרוב לארלוזורוב וויצמן וזבוטינסקי,POINT (668153.3772999998 3551279.7051),0.09482462317699009
810,2243,675.3662241659105,כיכר המדינה,צפונית לבית חולים איכילוב,POINT (668937.6744999997 3550609.5732),0.8462466651700918
811,1063,2521.4615314871985,תחנת הכוח רידינג,ארובה גבוהה בנוף עירוני ובבסיסה מבנה לבן גדול התחנה לא פעילה ולמרות זאת מסביבה עדיין בולטים עמודי חשמל רבים נמצאת בנקודת מפגש נחל הירקון וה,POINT (670508.7692999998 3553031.639799999),1.013541877339636
812,1071,6263.071727585026,תחנת הכוח רידינג,צמוד לנמל תל אביב,POINT (665094.6930999998 3547484.0284),0.9299698653595062
813,1074,1951.4618777215976,תחנת הכוח רידינג,צפון מערב תל אביב צמוד לים,POINT (668153.3772999998 3551279.7051),2.1623127092255476
814,1173,610.1742002310632,תחנת הכוח רידינג,צפון תל אביב על הים משמאל לשכונת כוכב הצפון,POINT (668503.0099999998 3553081.938300001),0.24382816914443783
815,1234,1647.5890555351184,תחנת הכוח רידינג,נמצאת בקצה שדרות רוקח צפונית לנמל תל אביב ןבקצה המערבי של שפך הירקון,POINT (669610.9971000003 3553026.7085),0.357081189956027
816,1241,3935.307772178771,תחנת הכוח רידינג,מגדל גבוה קרוב לים,POINT (668685.8531999998 3549367.898499999),2.162736602413646
817,1275,1951.4618777215976,תחנת הכוח רידינג,בחוף בתל אביב יש את הנמל שבנוי לאורך מספר חופים ששייכים לעיר יש להגיע לים ואז להתקדם לכיוון צפון ברצועת החוף עד שתגיעו לתחנת כוח שנמצאת בקצה,POINT (668153.3772999998 3551279.7051),0.9299698653595062
818,1290,669.8092574082078,תחנת הכוח רידינג,בנמל תל אביב ליד הים,POINT (667376.2593999999 3552593.3705),0.9277372686139191
819,1336,669.8092574082078,תחנת הכוח רידינג,בחלק הצפוני של נמל ץל אביה,POINT (667376.2593999999 3552593.3705),0.9277372686139191
820,1339,669.8092574082078,תחנת הכוח רידינג,צפון נמל תל אביב,POINT (667376.2593999999 3552593.3705),0.9277372686139191
821,1340,1951.4618777215976,תחנת הכוח רידינג,בסוף נמל תל אביב צפון,POINT (668153.3772999998 3551279.7051),0.9277372686139191
822,1342,1951.4618777215976,תחנת הכוח רידינג,הארובה בצפון תל אביב,POINT (668153.3772999998 3551279.7051),2.2430703223275534
823,1435,2615.5742161212397,תחנת הכוח רידינג,בעיר תל אביב ליד הים,POINT (666947.4577000001 3550674.1369),3.2940224181017244
824,1456,1824.9478869234586,תחנת הכוח רידינג,בקצה הצפוני של רחוב אבן גבירול ובצמוד ממערב לשדה דב הנטוש קיימת תחנת הכוח רידינג,POINT (668179.2938999999 3551416.8038),0.5491862406693815
825,1495,1865.7613376927718,תחנת הכוח רידינג,בסוף רחוב דיזינגוף בהתחברות עם דרך רוקח יש מגרש חנייה גדול עם המון אוטובוסים,POINT (667482.2296000002 3551325.649599999),1.1391205873363963
826,1519,1232.5981924646167,תחנת הכוח רידינג,צפון תל אביב צמוד לים וגובל מצפון לשפל הירקון לים תיכון,POINT (668910.3684999999 3552602.4059),0.357081189956027
827,1559,1951.4618777215976,תחנת הכוח רידינג,רידינג נמצאת בצפון תל אביב קרוב לים התיכון,POINT (668153.3772999998 3551279.7051),0.6267541638545787
828,1620,311.5550011250777,תחנת הכוח רידינג,צמוד למגדלור איפה שהיה שדה דב,POINT (668352.2078999998 3553514.306),0.5491862406693815
829,1646,3839.1729004068493,תחנת הכוח רידינג,על חוף הים מעט צפונית לירקון,POINT (666438.5607000003 3549553.2117),1.366123937272931
830,1678,667.4182291924723,תחנת הכוח רידינג,בנמל תל אביב,POINT (667384.6447999999 3552591.4901),0.9277372686139191
831,1713,98.68844908520764,תחנת הכוח רידינג,בצפון העיר על ספת הים מצפון לשפך הירקון ולנמל תל אביב,POINT (667640.0058000004 3553101.9768),0.357081189956027
832,1738,9057.06973375091,תחנת הכוח רידינג,צפון העיר צמוד לים אזור פתוח יחסית ולא קרוב לשכונת מגורים,POINT (670539.9643000001 3544577.2443),2.162736602413646
833,1778,1232.5981924646167,תחנת הכוח רידינג,ליד הים בקצה נחל הירקון,POINT (668910.3684999999 3552602.4059),1.366123937272931
834,1814,2521.4615314871985,תחנת הכוח רידינג,צפון תל אביב צמוד לירקון,POINT (670508.7692999998 3553031.639799999),1.366123937272931
835,1815,0.0,תחנת הכוח רידינג,תחנת הכוח רידינג נמצאת בצפון תל אביב בקצה הצפון מערבי של העיר,POINT (667812.1387999998 3553414.808499999),0.6267541638545787
836,1884,1951.4618777215976,תחנת הכוח רידינג,בצפון תל אביב,POINT (668153.3772999998 3551279.7051),2.2430703223275534
